[
  {
    "event_type": "sector_ping",
    "runner_id": "r123",
    "timestamp": "2025-09-16T04:58:08.418Z",
    "location": {
      "checkpoint_id": "cp01",
      "sector_name": "Far Loop",
      "lat": 39.120225060654676,
      "lon": -120.5597738842495
    },
    "source": {
      "system": "lora_beacon",
      "device_id": "node_07",
      "method": "BLE_scan"
    },
    "quality": {
      "confidence": 0.7,
      "priority": 0.5,
      "trust_level": "soft"
    },
    "meta": {
      "ingested_at": "2025-09-16T04:58:08.419Z"
    }
  },
  {
    "event_type": "lap_completed",
    "runner_id": "r456",
    "timestamp": "2025-09-16T04:58:08.496Z",
    "location": {
      "checkpoint_id": "start_finish",
      "sector_name": "Lap Start/Finish",
      "lat": 39.13004680178834,
      "lon": -120.5700610518466
    },
    "source": {
      "system": "timing_mat",
      "device_id": "mat_01",
      "method": "RFID_read"
    },
    "quality": {
      "confidence": 1,
      "priority": 1,
      "trust_level": "truth"
    },
    "meta": {
      "ingested_at": "2025-09-16T04:58:08.496Z"
    }
  },
  {
    "event_type": "sector_ping",
    "runner_id": "r456",
    "timestamp": "2025-09-16T04:58:10.435Z",
    "location": {
      "checkpoint_id": "cp01",
      "sector_name": "Far Loop",
      "lat": 39.12971228550951,
      "lon": -120.57038368003472
    },
    "source": {
      "system": "lora_beacon",
      "device_id": "node_07",
      "method": "BLE_scan"
    },
    "quality": {
      "confidence": 0.7,
      "priority": 0.5,
      "trust_level": "soft"
    },
    "meta": {
      "ingested_at": "2025-09-16T04:58:10.435Z"
    }
  },
  {
    "event_type": "sector_ping",
    "runner_id": "r123",
    "timestamp": "2025-09-16T04:58:12.455Z",
    "location": {
      "checkpoint_id": "cp01",
      "sector_name": "Far Loop",
      "lat": 39.12033747117889,
      "lon": -120.56006841416928
    },
    "source": {
      "system": "lora_beacon",
      "device_id": "node_07",
      "method": "BLE_scan"
    },
    "quality": {
      "confidence": 0.7,
      "priority": 0.5,
      "trust_level": "soft"
    },
    "meta": {
      "ingested_at": "2025-09-16T04:58:12.455Z"
    }
  },
  {
    "event_type": "sector_ping",
    "runner_id": "r123",
    "timestamp": "2025-09-16T04:58:13.456Z",
    "location": {
      "checkpoint_id": "cp01",
      "sector_name": "Far Loop",
      "lat": 39.119960526078636,
      "lon": -120.5595757317108
    },
    "source": {
      "system": "lora_beacon",
      "device_id": "node_07",
      "method": "BLE_scan"
    },
    "quality": {
      "confidence": 0.7,
      "priority": 0.5,
      "trust_level": "soft"
    },
    "meta": {
      "ingested_at": "2025-09-16T04:58:13.456Z"
    }
  },
  {
    "event_type": "sector_ping",
    "runner_id": "r123",
    "timestamp": "2025-09-16T04:58:15.479Z",
    "location": {
      "checkpoint_id": "cp01",
      "sector_name": "Far Loop",
      "lat": 39.11992148670107,
      "lon": -120.56036877494806
    },
    "source": {
      "system": "lora_beacon",
      "device_id": "node_07",
      "method": "BLE_scan"
    },
    "quality": {
      "confidence": 0.7,
      "priority": 0.5,
      "trust_level": "soft"
    },
    "meta": {
      "ingested_at": "2025-09-16T04:58:15.479Z"
    }
  },
  {
    "event_type": "lap_completed",
    "runner_id": "r123",
    "timestamp": "2025-09-16T04:58:17.503Z",
    "location": {
      "checkpoint_id": "start_finish",
      "sector_name": "Lap Start/Finish",
      "lat": 39.12022071050792,
      "lon": -120.5604424371107
    },
    "source": {
      "system": "timing_mat",
      "device_id": "mat_01",
      "method": "RFID_read"
    },
    "quality": {
      "confidence": 1,
      "priority": 1,
      "trust_level": "truth"
    },
    "meta": {
      "ingested_at": "2025-09-16T04:58:17.503Z"
    }
  },
  {
    "event_type": "projected_position",
    "runner_id": "r123",
    "timestamp": "2025-09-16T04:58:17.503Z",
    "location": {
      "lat": 39.120003031386204,
      "lon": -120.5601912376443,
      "sector_name": "Start"
    },
    "source": {
      "system": "projection_engine",
      "device_id": "proj_01",
      "method": "pace_interpolation"
    },
    "quality": {
      "confidence": 0.6,
      "priority": 0.25,
      "trust_level": "projection"
    },
    "meta": {
      "note": "synthetic projection",
      "ingested_at": "2025-09-16T04:58:17.503Z"
    }
  },
  {
    "event_type": "projected_position",
    "runner_id": "r456",
    "timestamp": "2025-09-16T04:58:17.503Z",
    "location": {
      "lat": 39.129704388139594,
      "lon": -120.57012744854202,
      "sector_name": "Start"
    },
    "source": {
      "system": "projection_engine",
      "device_id": "proj_01",
      "method": "pace_interpolation"
    },
    "quality": {
      "confidence": 0.6,
      "priority": 0.25,
      "trust_level": "projection"
    },
    "meta": {
      "note": "synthetic projection",
      "ingested_at": "2025-09-16T04:58:17.503Z"
    }
  },
  {
    "event_type": "sector_ping",
    "runner_id": "r123",
    "timestamp": "2025-09-16T04:58:18.512Z",
    "location": {
      "checkpoint_id": "cp01",
      "sector_name": "Far Loop",
      "lat": 39.119940324996875,
      "lon": -120.55955311952837
    },
    "source": {
      "system": "lora_beacon",
      "device_id": "node_07",
      "method": "BLE_scan"
    },
    "quality": {
      "confidence": 0.7,
      "priority": 0.5,
      "trust_level": "soft"
    },
    "meta": {
      "ingested_at": "2025-09-16T04:58:18.512Z"
    }
  },
  {
    "event_type": "sector_ping",
    "runner_id": "r456",
    "timestamp": "2025-09-16T04:58:18.512Z",
    "location": {
      "checkpoint_id": "cp01",
      "sector_name": "Far Loop",
      "lat": 39.12988790654893,
      "lon": -120.57031707160175
    },
    "source": {
      "system": "lora_beacon",
      "device_id": "node_07",
      "method": "BLE_scan"
    },
    "quality": {
      "confidence": 0.7,
      "priority": 0.5,
      "trust_level": "soft"
    },
    "meta": {
      "ingested_at": "2025-09-16T04:58:18.512Z"
    }
  },
  {
    "event_type": "sector_ping",
    "runner_id": "r456",
    "timestamp": "2025-09-16T04:58:19.529Z",
    "location": {
      "checkpoint_id": "cp01",
      "sector_name": "Far Loop",
      "lat": 39.12982768325811,
      "lon": -120.56958831133184
    },
    "source": {
      "system": "lora_beacon",
      "device_id": "node_07",
      "method": "BLE_scan"
    },
    "quality": {
      "confidence": 0.7,
      "priority": 0.5,
      "trust_level": "soft"
    },
    "meta": {
      "ingested_at": "2025-09-16T04:58:19.529Z"
    }
  },
  {
    "event_type": "lap_completed",
    "runner_id": "r123",
    "timestamp": "2025-09-16T04:58:21.531Z",
    "location": {
      "checkpoint_id": "start_finish",
      "sector_name": "Lap Start/Finish",
      "lat": 39.11955646194638,
      "lon": -120.55955919136157
    },
    "source": {
      "system": "timing_mat",
      "device_id": "mat_01",
      "method": "RFID_read"
    },
    "quality": {
      "confidence": 1,
      "priority": 1,
      "trust_level": "truth"
    },
    "meta": {
      "ingested_at": "2025-09-16T04:58:21.531Z"
    }
  },
  {
    "event_type": "sector_ping",
    "runner_id": "r456",
    "timestamp": "2025-09-16T04:58:22.544Z",
    "location": {
      "checkpoint_id": "cp01",
      "sector_name": "Far Loop",
      "lat": 39.130278610139825,
      "lon": -120.56976838343903
    },
    "source": {
      "system": "lora_beacon",
      "device_id": "node_07",
      "method": "BLE_scan"
    },
    "quality": {
      "confidence": 0.7,
      "priority": 0.5,
      "trust_level": "soft"
    },
    "meta": {
      "ingested_at": "2025-09-16T04:58:22.544Z"
    }
  },
  {
    "event_type": "sector_ping",
    "runner_id": "r456",
    "timestamp": "2025-09-16T04:58:23.554Z",
    "location": {
      "checkpoint_id": "cp01",
      "sector_name": "Far Loop",
      "lat": 39.13014792606868,
      "lon": -120.56959508726078
    },
    "source": {
      "system": "lora_beacon",
      "device_id": "node_07",
      "method": "BLE_scan"
    },
    "quality": {
      "confidence": 0.7,
      "priority": 0.5,
      "trust_level": "soft"
    },
    "meta": {
      "ingested_at": "2025-09-16T04:58:23.554Z"
    }
  },
  {
    "event_type": "sector_ping",
    "runner_id": "r123",
    "timestamp": "2025-09-16T04:58:24.567Z",
    "location": {
      "checkpoint_id": "cp01",
      "sector_name": "Far Loop",
      "lat": 39.12041983679389,
      "lon": -120.5600893915309
    },
    "source": {
      "system": "lora_beacon",
      "device_id": "node_07",
      "method": "BLE_scan"
    },
    "quality": {
      "confidence": 0.7,
      "priority": 0.5,
      "trust_level": "soft"
    },
    "meta": {
      "ingested_at": "2025-09-16T04:58:24.567Z"
    }
  },
  {
    "event_type": "lap_completed",
    "runner_id": "r123",
    "timestamp": "2025-09-16T04:58:25.568Z",
    "location": {
      "checkpoint_id": "start_finish",
      "sector_name": "Lap Start/Finish",
      "lat": 39.11978694288512,
      "lon": -120.56015905713497
    },
    "source": {
      "system": "timing_mat",
      "device_id": "mat_01",
      "method": "RFID_read"
    },
    "quality": {
      "confidence": 1,
      "priority": 1,
      "trust_level": "truth"
    },
    "meta": {
      "ingested_at": "2025-09-16T04:58:25.568Z"
    }
  },
  {
    "event_type": "sector_ping",
    "runner_id": "r456",
    "timestamp": "2025-09-16T04:58:25.568Z",
    "location": {
      "checkpoint_id": "cp01",
      "sector_name": "Far Loop",
      "lat": 39.12994533678177,
      "lon": -120.56969529801877
    },
    "source": {
      "system": "lora_beacon",
      "device_id": "node_07",
      "method": "BLE_scan"
    },
    "quality": {
      "confidence": 0.7,
      "priority": 0.5,
      "trust_level": "soft"
    },
    "meta": {
      "ingested_at": "2025-09-16T04:58:25.568Z"
    }
  },
  {
    "event_type": "lap_completed",
    "runner_id": "r123",